,source,author,title,description,url,urlToImage,publishedAt,content
35,"{'id': 'business-insider', 'name': 'Business Insider'}",Melia Russell,Initialized's Jen Wolf is moving up to become president of the early-stage VC firm. She reveals its strategy for winning deals as competition heats up.,"Summary List PlacementBefore Garry Tan had the Midas touch, he was Jen Wolf's intern.
But since then, the tables have turned a bit. For the past five years, Wolf has worked at Initialized Capital, the venture firm started by Tan, as head of operations. This w…",https://www.businessinsider.com/initialized-capital-promotes-jen-wolf-president-2021-5,https://i.insider.com/60a558bee25d05001880c842?width=1200&format=jpeg,2021-05-20T14:30:00Z,"Before Garry Tan had the Midas touch, he was Jen Wolf's intern.
But since then, the tables have turned a bit. For the past five years, Wolf has worked at Initialized Capital, the venture firm starte… [+3320 chars]"
36,"{'id': 'business-insider', 'name': 'Business Insider'}",aperelli@businessinsider.com (Amanda Perelli),Olivia Jade is rebuilding her influencer business after the college-admissions scandal,The top influencer news of the week includes how podcasters can make money using Patreon and inside a management firm focused on diverse talent.,https://www.businessinsider.com/influencer-news-olivia-jade-patreon-money-tiktok-brand-deals-2021-5,https://i.insider.com/60a55896f27b4c0019445693?width=1200&format=jpeg,2021-05-20T12:06:09Z,"Hi, this is Amanda Perelli and welcome back to Insider Influencers, our weekly rundown on the business of influencers, creators, and social-media platforms. Sign up for the newsletter here.
In this … [+6781 chars]"
37,"{'id': 'business-insider', 'name': 'Business Insider'}",Shona Ghosh,Read the letter by ByteDance's billionaire CEO explaining why he wants to leave the top job and 'keep exploring',"Summary List PlacementZhang Yiming, the millennial chief exec of TikTok parent company ByteDance, is to step away from the top job and hand the role over to cofounder and college friend Liang Rubo.
The move is an unusual one. Under Zhang's watch, TikTok's pop…",https://www.businessinsider.com/full-resignation-letter-bytedance-ceo-zhang-yiming-2021-5,https://i.insider.com/5f4954e87ffa48002894cef7?width=1200&format=jpeg,2021-05-20T10:26:26Z,"Zhang Yiming, the millennial chief exec of TikTok parent company ByteDance, is to step away from the top job and hand the role over to cofounder and college friend Liang Rubo.
The move is an unusual… [+7565 chars]"
38,"{'id': 'business-insider', 'name': 'Business Insider'}",Tim Levin,"Ford F-150 Lightning debuts with a $39,974 starting MSRP, up to 300 miles of range, and 563 horsepower (F)","Summary List PlacementFollowing years of speculation and anticipation, Ford on Wednesday took the wraps off of its debut all-electric pickup truck: the F-150 Lightning. 
The battery-powered version of America's favorite truck offers extra performance and some…",https://www.businessinsider.com/ford-f150-lightning-electric-revealed-price-specs-range-2021-5,https://i.insider.com/60a56fb4e25d05001880c8bf?width=1200&format=jpeg,2021-05-20T01:30:00Z,"Following years of speculation and anticipation, Ford on Wednesday took the wraps off of its debut all-electric pickup truck: the F-150 Lightning. 
The battery-powered version of America's favorite … [+3527 chars]"
39,"{'id': 'business-insider', 'name': 'Business Insider'}",William Antonelli,iPhones don't come with AirPods or EarPods — here's what comes with new iPhones,"Summary List PlacementApple's wireless AirPods are some of the most popular headphones in the world right now. However, they can be expensive — especially if you're looking for the new AirPods Max, which retails at nearly $550.
With how popular AirPods are, y…",https://www.businessinsider.com/do-iphones-come-with-airpods,https://i.insider.com/60a5701ff27b4c0019445720?width=1200&format=jpeg,2021-05-19T20:12:13Z,"Apple's wireless AirPods are some of the most popular headphones in the world right now. However, they can be expensive especially if you're looking for the new AirPods Max, which retails at nearly $… [+1733 chars]"
40,"{'id': 'financial-post', 'name': 'Financial Post'}",Reuters,Apple's Tim Cook takes stand to defend App Store at trial with 'Fortnite' maker - Financial Post,"<ol><li>Apple's Tim Cook takes stand to defend App Store at trial with 'Fortnite' maker  Financial Post
</li><li>Apple CEO to take the stand in Epic lawsuit that says App Store is an unfair monopoly  CBC.ca
</li><li>Apple CEO Tim Cook says 'threat profile' …",https://financialpost.com/pmn/business-pmn/apples-tim-cook-takes-stand-to-defend-app-store-at-trial-with-fortnite-maker,,2021-05-21T15:37:33Z,"Article content
Apple Inc Chief Executive Tim Cook on Friday took the witness stand to defend the App Store, a booming part of the iPhone makers business that Fortnite online game maker Epic Games s… [+4684 chars]"
41,"{'id': 'financial-post', 'name': 'Financial Post'}",Reuters,Snap to buy augmented reality company WaveOptics for over $500 mln - Regina Leader-Post,"<ol><li>Snap to buy augmented reality company WaveOptics for over $500 mln  Regina Leader-Post
</li><li>Snap unveils all-new Spectacles with built-in augmented reality  Yahoo Canada Finance
</li><li>Snap’s new Spectacles let you see the world in augmented r…",https://financialpost.com/pmn/business-pmn/snap-to-buy-augmented-reality-company-waveoptics-for-over-500-mln,,2021-05-21T14:53:38Z,"Snap Inc said Friday it will acquire WaveOptics Ltd, a British augmented reality (AR) technology company, for over $500 million.
The deal, first reported by The Verge and confirmed by a Snap spokesm… [+1044 chars]"
42,"{'id': 'financial-post', 'name': 'Financial Post'}",Reuters,"Snap plans new video editing app, augmented reality features - Financial Post","<ol><li>Snap plans new video editing app, augmented reality features  Financial Post
</li><li>Snap’s new Spectacles let you see the world in augmented reality  The Verge
</li><li>Snap's Story Studio is a 'powerful' mobile video editing app  Engadget
</li><…",https://financialpost.com/pmn/business-pmn/snap-plans-new-video-editing-app-augmented-reality-features,,2021-05-20T18:07:52Z,"Snap Inc, owner of photo messaging app Snapchat, announced Thursday it will launch a new standalone app later this year called Story Studio, with video editing tools to help users make professional-l… [+1255 chars]"
43,"{'id': 'financial-post', 'name': 'Financial Post'}",Gabriel Friedman,Myths about Canada's pandemic 'recession': Sprott School of Business' Ian Lee,"Across Canada, government debt is rising and is likely to continue to rise. What are the potential impacts and should we be concerned? 
 
 
 
 
 
 This week, on Down to Business, Ian Lee, an associate professor of Management at Carleton University’s Sprott Sc…",https://financialpost.com/news/economy/myths-about-canadas-pandemic-recession-sprott-school-of-business-ian-lee,https://smartcdn.prod.postmedia.digital/financialpost/wp-content/uploads/2021/05/recession0519.jpg,2021-05-19T11:00:53Z,"Article content
Across Canada, government debt is rising and is likely to continue to rise. What are the potential impacts and should we be concerned?
This week, on Down to Business, Ian Lee, an as… [+871 chars]"
44,"{'id': 'financial-post', 'name': 'Financial Post'}",Reuters,Apple's App Store chief kicks off iPhone maker's defense at Epic Games trial - Financial Post,"<ol><li>Apple's App Store chief kicks off iPhone maker's defense at Epic Games trial  Financial Post
</li><li>Parler returns to Apple App Store with some content excluded  The Verge
</li><li>Why Roblox’s definition of “games” is key to the Epic vs. Apple ca…",https://financialpost.com/pmn/business-pmn/apples-app-store-chief-kicks-off-iphone-makers-defense-at-epic-games-trial,,2021-05-17T18:35:19Z,"Article content
Apple Inc on Monday began its formal defense in an antitrust trial brought by Fortnite online game creator Epic Games, by calling its App Store chief Phil Schiller to the stand.
Sch… [+1942 chars]"
45,"{'id': 'financial-post', 'name': 'Financial Post'}",Reuters,"Parler returns to Apple's App Store, names new CEO - Financial Post","<ol><li>Parler returns to Apple's App Store, names new CEO  Financial Post
</li><li>Parler Returns to the App Store With Improved Moderation  MacRumors
</li><li>Social app Parler is cracking down on hate speech — but only on iPhones  The Washington Post
</…",https://financialpost.com/pmn/business-pmn/parler-returns-to-apples-app-store-names-new-ceo-2,,2021-05-17T16:29:16Z,"Article content
Parler, a social media app popular with U.S. conservatives, returned to Apple Incs App Store on Monday, after the iPhone maker dropped it following the deadly Jan. 6 riot at the U.S.… [+2223 chars]"
46,"{'id': 'financial-post', 'name': 'Financial Post'}",Reuters,"Amazon, Apple not to charge extra for lossless music - Financial Post","<ol><li>Amazon, Apple not to charge extra for lossless music  Financial Post
</li><li>Apple bringing Hi-Fi quality audio and Dolby Atmos to Apple Music  MobileSyrup
</li><li>Is Apple about to up its audio game with lossless Apple Music?  A Journal of Musica…",https://financialpost.com/pmn/business-pmn/amazon-apple-not-to-charge-extra-for-lossless-music,,2021-05-17T15:27:57Z,"Amazon.com Inc and Apple Inc will let users stream high-quality lossless audio at no extra charge, as they explore new ways to keep subscribers tuned in to their services amid intense competition.
A… [+831 chars]"
47,"{'id': 'google-news', 'name': 'Google News'}",B2b Growth: Your Daily B2b Marketing Podcast,B2B Growth: Your Daily B2B Marketing Podcast - Introducing a New Podcast: On the Whistle,"On the Whistle explores the impact that coaches, teachers and administrators from schools and youth organizations have on improving young people’s lives. Each episode features topics such as resilience, leadership, responsibility, and self-awareness as we exa…",https://podcasts.google.com/feed/aHR0cHM6Ly9mZWVkcy5zb3VuZGVyLmZtLzgwOTIvcnNzLnhtbA/episode/MTUwNjM3YzQtYmE3Ny00YmM4LWJkMzItYmU5OGFjOGJjOTQ5,https://encrypted-tbn2.gstatic.com/images?q=tbn:ANd9GcQM26dOMF_WWxSMcBZZc9uz2gwtDMkQD-uun0dhDAD_aapVhPf-,2021-05-21T14:51:40Z,"On the Whistle explores the impact that coaches, teachers and administrators from schools and youth organizations have on improving young peoples lives. Each episode features topics such as resilienc… [+404 chars]"
48,"{'id': 'reuters', 'name': 'Reuters'}","Medha Singh,Krystal Hu",U.S. stocks end mixed as Dow recovers on strong economic data - Reuters,"Wall Street closed mixed at the end of a volatile week of trading, with the Dow Jones Industrial Average being the only bright spot, as inflation concerns loom over growth names.",https://www.reuters.com/business/us-stocks-end-mixed-dow-recovers-strong-economic-data-2021-05-21/,https://www.reuters.com/resizer/kGxGDFM0_rLTWqIP2zxfhM5U4EQ=/1200x628/smart/cloudfront-us-east-2.images.arcpublishing.com/reuters/ZD5MAJ6DRNOEJIOOFUXJ2QJ7XQ.jpg,2021-05-21T20:57:00Z,"Wall Street closed mixed at the end of a volatile week of trading, with the Dow Jones Industrial Average being the only bright spot, as inflation concerns loom over growth names.
The Dow was lifted … [+3390 chars]"
49,"{'id': 'reuters', 'name': 'Reuters'}","Medha Singh,Krystal Hu",U.S. stocks end mixed as Dow extends recovery after strong economic data - Reuters,"Wall Street ended mixed on Friday, with inflation concerns looming at the end of a volatile week of trading.",https://www.reuters.com/business/us-stocks-end-mixed-dow-extends-recovery-after-strong-economic-data-2021-05-21/,,2021-05-21T20:05:00Z,"Wall Street ended mixed on Friday, with inflation concerns looming at the end of a volatile week of trading.
The Dow Jones Industrial Average rose with the help of Boeing (BA.N), which jumped as ind… [+2677 chars]"
50,"{'id': 'reuters', 'name': 'Reuters'}",Reuters,Lady Gaga tells of 'psychotic break' after rape at 19 left her pregnant - Reuters,"Lady Gaga said she suffered a ""psychotic break"" after being raped and made pregnant by a producer at age 19 as she was trying to get a foothold in the music industry.",https://www.reuters.com/business/media-telecom/lady-gaga-tells-psychotic-break-after-rape-19-left-her-pregnant-2021-05-21/,https://www.reuters.com/resizer/45OosdU2rmmi6j35CAKb7rZeym4=/1200x628/smart/cloudfront-us-east-2.images.arcpublishing.com/reuters/XL4TN2CE2VMOVA4JM2CEGJCXJA.jpg,2021-05-21T17:54:00Z,"Lady Gaga said she suffered a ""psychotic break"" after being raped and made pregnant by a producer at age 19 as she was trying to get a foothold in the music industry.
Gaga, now 35, gave details of t… [+1374 chars]"
51,"{'id': 'reuters', 'name': 'Reuters'}",Stephen Nellis,Apple's Tim Cook says 'threat profile' of iPhone justifies App Store rules,"Apple Inc Chief Executive Tim Cook on Friday told a court that threats to iPhone security and privacy required tight control of the App Store, which ""Fortnite"" game maker Epic Games says is a monopoly that Apple illegally abuses.",https://www.reuters.com/article/legal-us-apple-epic-games-idUSKCN2D217Z,https://static.reuters.com/resources/r/?m=02&d=20210521&t=2&i=1562947201&r=LYNXNPEH4K0NT&w=800,2021-05-21T17:52:30Z,"(Reuters) - Apple Inc Chief Executive Tim Cook on Friday told a court that threats to iPhone security and privacy required tight control of the App Store, which Fortnite game maker Epic Games says is… [+3504 chars]"
52,"{'id': 'reuters', 'name': 'Reuters'}",Reuters Staff,Lady Gaga tells of 'psychotic break' after rape at 19 left her pregnant,"Lady Gaga said she suffered a ""psychotic break"" after being raped and made pregnant by a producer at age 19 as she was trying to get a foothold in the music industry.",https://www.reuters.com/article/us-people-lady-gaga-idUSKCN2D22CB,https://static.reuters.com/resources/r/?m=02&d=20210521&t=2&i=1562991313&r=LYNXNPEH4K18F&w=800,2021-05-21T17:38:11Z,"By Reuters Staff
LOS ANGELES (Reuters) - Lady Gaga said she suffered a psychotic break after being raped and made pregnant by a producer at age 19 as she was trying to get a foothold in the music in… [+1329 chars]"
53,"{'id': 'reuters', 'name': 'Reuters'}",Reuters,Factbox: Five things to know about Epic's epic legal fight with Apple - Reuters,"Apple Inc (AAPL.O) Chief Executive Tim Cook takes the witness stand on Friday to defend the lucrative App Store against ""Fortnite"" maker Epic Games' allegations that it is a monopoly that Apple illegally abuses.",https://www.reuters.com/technology/five-things-know-about-epics-epic-legal-fight-with-apple-2021-05-21/,https://www.reuters.com/resizer/ZqRzjb525R_3B5cblkckZGMgDcY=/1200x628/smart/cloudfront-us-east-2.images.arcpublishing.com/reuters/CVS7ZKZDQBMY7FBHH5D7V6BLGE.jpg,2021-05-21T17:11:00Z,"Apple CEO Tim Cook gestures from the elevator as he arrives to speak during a weeks-long antitrust trial at federal court in Oakland, California, U.S. May 21, 2021. REUTERS/Brittany Hosea-SmallApple … [+2636 chars]"
54,"{'id': 'reuters', 'name': 'Reuters'}",Eva  Mathews,Netflix in search of executive to oversee gaming expansion - source - Reuters,"Netflix Inc is looking to hire an executive to oversee its expansion into videogames, a person familiar with the matter said, a sign that it is ramping up efforts to grow beyond its traditional business as streaming competition intensifies.",https://www.reuters.com/article/us-netflix-gaming-idUSKCN2D21N1,https://static.reuters.com/resources/r/?m=02&d=20210521&t=2&i=1562959523&r=LYNXNPEH4K0US&w=800,2021-05-21T17:10:53Z,"FILE PHOTO: The Netflix logo is seen on their office in Hollywood, Los Angeles, California, U.S. July 16, 2018. REUTERS/Lucy Nicholson/File Photo
(Reuters) -Netflix Inc is looking to hire an executi… [+968 chars]"
55,"{'id': 'reuters', 'name': 'Reuters'}",Stephen Nellis,FACTBOX-Five things to know about Epic's epic legal fight with Apple,"Apple Inc Chief Executive Tim Cook takes the witness stand on Friday to defend the lucrative App Store against ""Fortnite"" maker Epic Games' allegations that it is a monopoly that Apple illegally abuses.",https://www.reuters.com/article/legal-us-apple-epic-games-fortnite-idUSKCN2D2298,https://static.reuters.com/resources/r/?m=02&d=20210521&t=2&i=1562987528&r=LYNXNPEH4K16V&w=800,2021-05-21T16:56:45Z,WASHINGTON (Reuters) - Apple Inc Chief Executive Tim Cook takes the witness stand on Friday to defend the lucrative App Store against Fortnite maker Epic Games allegations that it is a monopoly that … [+2528 chars]
56,"{'id': 'reuters', 'name': 'Reuters'}",Sheila Dang,Snap to buy augmented reality company WaveOptics for over $500 mln - Reuters,"Snap Inc (SNAP.N) said Friday it will acquire WaveOptics Ltd, a British augmented reality (AR) technology company, for over $500 million.",https://www.reuters.com/technology/snap-buy-augmented-reality-company-waveoptics-over-500-mln-2021-05-21/,https://www.reuters.com/resizer/wuj1igDC1t-PlluHxcd5naYaqBY=/1200x628/smart/cloudfront-us-east-2.images.arcpublishing.com/reuters/PN4MFUPTHFIVZFRTCTULYLTCA4.jpg,2021-05-21T15:04:00Z,"A woman stands in front of the logo of Snap Inc on the floor of the New York Stock Exchange (NYSE) in New York City, NY, U.S. March 2, 2017. REUTERS/Lucas JacksonSnap Inc (SNAP.N) said Friday it will… [+1242 chars]"
57,"{'id': 'reuters', 'name': 'Reuters'}",Sheila Dang,Snap to buy augmented reality company WaveOptics for over $500 million,"Snap Inc said Friday it will acquire WaveOptics Ltd, a British augmented reality (AR) technology company, for over $500 million.",https://www.reuters.com/article/us-snap-augmented-reality-idUSKCN2D21VJ,https://static.reuters.com/resources/r/?m=02&d=20210521&t=2&i=1562970945&r=LYNXNPEH4K105&w=800,2021-05-21T14:56:39Z,"FILE PHOTO: A woman stands in front of the logo of Snap Inc on the floor of the New York Stock Exchange (NYSE) in New York City, NY, U.S. March 2, 2017. REUTERS/Lucas Jackson
(Reuters) - Snap Inc sa… [+1177 chars]"
58,"{'id': 'reuters', 'name': 'Reuters'}",Reuters,"Nvidia sets 4-for-1 stock split, shares rise - Reuters","Nvidia Corp (NVDA.O) on Friday announced a four-for-one stock split as it looks to make its stock less expensive for investors, sending the chipmaker's shares up 3%.",https://www.reuters.com/technology/nvidia-sets-4-for-1-stock-split-shares-rise-2021-05-21/,https://www.reuters.com/resizer/uPPdu3aa9NxhqVz4dLhAtmJIZXw=/1200x628/smart/cloudfront-us-east-2.images.arcpublishing.com/reuters/EP6RAN2YGNJTNKLHKF3WNQP7GM.jpg,2021-05-21T13:43:00Z,"The logo of technology company Nvidia is seen at its headquarters in Santa Clara, California, February 11, 2015. REUTERS/Robert Galbraith/File PhotoNvidia Corp (NVDA.O) on Friday announced a four-for… [+1080 chars]"
59,"{'id': 'reuters', 'name': 'Reuters'}",Reuters,Netflix looking to hire executive for gaming expansion - The Information - Reuters,"Netflix Inc (NFLX.O) is looking to hire an executive to oversee its expansion into videogames, The Information reported on Friday, citing people familiar with the matter.",https://www.reuters.com/technology/netflix-looking-hire-executive-gaming-expansion-information-2021-05-21/,,2021-05-21T13:38:00Z,"Netflix Inc (NFLX.O) is looking to hire an executive to oversee its expansion into videogames, The Information reported on Friday, citing people familiar with the matter.
The company has approached … [+796 chars]"
60,"{'id': 'reuters', 'name': 'Reuters'}","Terry Slavin – Editor, Reuters Professional",ANALYSIS: Strong stick of regulation will be needed to commandeer big business into hitting new climate - Reuters,"Joe Biden’s ambitious pledge last month to halve U.S. greenhouse gas emissions by 2030, and the EU’s move to raise its 2030 target for cutting emissions from 40% to 55%, appear to be two leaps forward for humankind by pushing for urgent action to turn the tid…",https://www.reuters.com/article/events-biden-idUSMTZSPDEH5LGJLRIH,https://static.reuters.com/resources/r/?m=02&d=20210521&t=2&i=1562956332&r=MTZSPDEH5LGJLRIG&w=800,2021-05-21T13:04:42Z,"Joe Bidens ambitious pledge last month to halve U.S. greenhouse gas emissions by 2030, and the EUs move to raise its 2030 target for cutting emissions from 40% to 55%, appear to be two leaps forward … [+7270 chars]"
61,"{'id': 'reuters', 'name': 'Reuters'}",Reuters Staff,White House partners Tinder parent in hopes users swipe right on vaccinations - Reuters,"Match Group Inc said on Friday it had teamed up with the White House to promote COVID-19 vaccinations across its popular online dating apps such as Tinder, OkCupid and Hinge.",https://www.reuters.com/article/us-health-coronavirus-match-grp-idUSKCN2D21L8,https://static.reuters.com/resources/r/?m=02&d=20210521&t=2&i=1562957457&r=LYNXNPEH4K0U0&w=800,2021-05-21T13:04:37Z,"By Reuters Staff
FILE PHOTO: The dating app Tinder is shown on an Apple iPhone in this photo illustration taken February 10, 2016. REUTERS/Mike Blake/Illustration/File Photo GLOBAL BUSINESS WEEK AHE… [+1055 chars]"
62,"{'id': 'reuters', 'name': 'Reuters'}",Stephen Nellis,Apple's Tim Cook to defend App Store at trial with Fortnite maker - Reuters,"Apple Inc (AAPL.O) Chief Executive Tim Cook on Friday will take the witness stand to defend the App Store, a booming part of the iPhone maker's business that ""Fortnite"" maker Epic Games says is a monopoly that Apple abuses.",https://www.reuters.com/business/legal/apples-tim-cook-defend-app-store-trial-with-fortnite-maker-2021-05-21/,https://www.reuters.com/resizer/syJODEdY2h4i4cE4DhupFFJJ0U0=/1200x628/smart/cloudfront-us-east-2.images.arcpublishing.com/reuters/FLUEVVF2AFM3TLW5PNFT3HGSRY.jpg,2021-05-21T11:34:00Z,"Apple Inc (AAPL.O) Chief Executive Tim Cook on Friday will take the witness stand to defend the App Store, a booming part of the iPhone maker's business that ""Fortnite"" maker Epic Games says is a mon… [+2990 chars]"
63,"{'id': 'reuters', 'name': 'Reuters'}",Reuters Staff,Prince Harry: pain of Diana's death pushed me to drink and drugs - Reuters,"Prince Harry said he abused alcohol to numb the pain of his mother Diana's death in 1997, and accused the British royal family of neglecting him and his wife Meghan as she contemplated suicide.",https://www.reuters.com/article/uk-britain-royals-idUSKCN2D20Z2,https://static.reuters.com/resources/r/?m=02&d=20210521&t=2&i=1562935505&r=LYNXNPEH4K0H2&w=800,2021-05-21T10:13:56Z,"By Reuters Staff
LONDON (Reuters) - Prince Harry said he abused alcohol to numb the pain of his mother Dianas death in 1997, and accused the British royal family of neglecting him and his wife Megha… [+1779 chars]"
64,"{'id': 'reuters', 'name': 'Reuters'}",Lewis Krauskopf,Wall St Week Ahead U.S. investors look to Europe for next leg of stock gains - Reuters,"As U.S. stocks are hit with a bout of volatility, some investors are looking to European equities, attracted by lower valuations and the region’s nascent emergence from the COVID-19 pandemic.",https://www.reuters.com/business/wall-st-week-ahead-us-investors-look-europe-next-leg-stock-gains-2021-05-21/,,2021-05-21T10:12:00Z,"As U.S. stocks are hit with a bout of volatility, some investors are looking to European equities, attracted by lower valuations and the regions nascent emergence from the COVID-19 pandemic.
Europea… [+4287 chars]"
65,"{'id': 'reuters', 'name': 'Reuters'}",Mike Dolan,COLUMN-Bitcoin volatility keeps it in 'neverland' :Mike Dolan - Reuters,Bitcoin's wild ride this week is far from unusual for the largest crypto token - but the rollercoaster is also its inherent contradiction.,https://www.reuters.com/article/us-global-crypto-currency-idUSKCN2D2125,https://static.reuters.com/resources/r/?m=02&d=20210521&t=2&i=1562937583&r=LYNXNPEH4K0IL&w=800,2021-05-21T10:04:59Z,"LONDON (Reuters) - Bitcoins wild ride this week is far from unusual for the largest crypto token - but the rollercoaster is also its inherent contradiction.
Representations of the virtual currency B… [+5415 chars]"
66,"{'id': 'reuters', 'name': 'Reuters'}",Lewis Krauskopf,U.S. investors look to Europe for next leg of stock gains - Reuters,"As U.S. stocks are hit with a bout of volatility, some investors are looking to European equities, attracted by lower valuations and the region’s nascent emergence from the COVID-19 pandemic.",https://www.reuters.com/article/us-usa-stocks-weekahead-idUSKCN2D2111,https://static.reuters.com/resources/r/?m=02&d=20210521&t=2&i=1562936689&r=LYNXNPEH4K0I1&w=800,2021-05-21T10:04:00Z,"NEW YORK (Reuters) - As U.S. stocks are hit with a bout of volatility, some investors are looking to European equities, attracted by lower valuations and the regions nascent emergence from the COVID-… [+4375 chars]"
67,"{'id': 'reuters', 'name': 'Reuters'}",Reuters,Prince Harry: pain of Diana's death pushed me to drink and drugs - Reuters UK,"Prince Harry said he abused alcohol to numb the pain of his mother Diana's death in 1997, and accused the British royal family of neglecting him and his wife Meghan as she contemplated suicide.",https://www.reuters.com/world/uk/prince-harry-pain-dianas-death-pushed-me-drink-drugs-2021-05-21/,https://www.reuters.com/resizer/0zFt1M1jV0mSfzA_jMNBS71hvBE=/1200x628/smart/cloudfront-us-east-2.images.arcpublishing.com/reuters/4JLP45LV3VN57AX62WKK32ERX4.jpg,2021-05-21T09:45:00Z,"Prince Harry said he abused alcohol to numb the pain of his mother Dianas death in 1997, and accused the British royal family of neglecting him and his wife Meghan as she contemplated suicide.
Harry… [+1807 chars]"
